Client,Service,Industry,Challenge,Solution,Results,Image URL,Link,Disclaimer
Precision Dental Lab,SEO + Content,Dental Lab,Low online visibility,Comprehensive SEO strategy with targeted content,150% increase in organic traffic,/images/case-studies/precision-dental.jpg,https://example.com/case-study-1,Results may vary and are not guaranteed
Elite Crown Works,Social Posts + Meta Ads,Dental Lab,Limited social presence,Strategic social media campaign with targeted ads,300% increase in social engagement,/images/case-studies/elite-crown.jpg,https://example.com/case-study-2,Results may vary and are not guaranteed
Advanced Prosthetics,Google Ads + GBP,Dental Lab,Poor local search ranking,Local SEO optimization with Google Ads,200% increase in local leads,/images/case-studies/advanced-prosthetics.jpg,https://example.com/case-study-3,Results may vary and are not guaranteed
Smile Innovations Lab,Content + Backlinks,Dental Lab,Low domain authority,Content marketing with strategic link building,180% increase in domain authority,/images/case-studies/smile-innovations.jpg,https://example.com/case-study-4,Results may vary and are not guaranteed
Premier Dental Solutions,Full Marketing Suite,Dental Lab,Declining market share,Comprehensive digital marketing strategy,250% increase in qualified leads,/images/case-studies/premier-dental.jpg,https://example.com/case-study-5,Results may vary and are not guaranteed
TechDent Laboratory,TikTok Ads + Social,Dental Lab,Reaching younger dentists,Modern social media approach with TikTok advertising,400% increase in millennial dentist clients,/images/case-studies/techdent.jpg,https://example.com/case-study-6,Results may vary and are not guaranteed
